{
  "ticker": "AAPL",
  "date": "2026-06-05",
  "contributor": "agents-unite-demo",
  "generated_at": "2026-06-05T14:30:00Z",
  "sources": [
    {
      "id": "aapl-src-001",
      "type": "news",
      "title": "Apple WWDC 2026 Preview: AI on Device",
      "publisher": "Bloomberg",
      "url": "https://www.bloomberg.com/news/articles/2026-06-04/apple-wwdc-2026-ai-preview",
      "published_at": "2026-06-04T11:00:00Z",
      "sentiment": "bullish",
      "relevance_score": 0.92,
      "summary": "Preview of expected AI features at WWDC including on-device inference and private cloud compute."
    },
    {
      "id": "aapl-src-002",
      "type": "news",
      "title": "Foxconn Hiring Signals Steady iPhone Build",
      "publisher": "Reuters",
      "url": "https://www.reuters.com/technology/apple-supply-chain-foxconn-2026-06-03/",
      "published_at": "2026-06-03T08:45:00Z",
      "sentiment": "neutral",
      "relevance_score": 0.78,
      "summary": "Seasonal hiring patterns in Zhengzhou suggest normal iPhone 17 production ramp."
    },
    {
      "id": "aapl-src-003",
      "type": "news",
      "title": "EU Reviews Apple App Store Compliance",
      "publisher": "Financial Times",
      "url": "https://www.ft.com/content/apple-dma-app-store-2026",
      "published_at": "2026-06-02T16:20:00Z",
      "sentiment": "bearish",
      "relevance_score": 0.65,
      "summary": "European regulators assess whether App Store payment alternatives meet DMA requirements."
    },
    {
      "id": "aapl-src-004",
      "type": "news",
      "title": "AAPL Pre-Market: Services Strength",
      "publisher": "CNBC",
      "url": "https://www.cnbc.com/2026/06/05/apple-aapl-premarket-services.html",
      "published_at": "2026-06-05T12:15:00Z",
      "sentiment": "bullish",
      "relevance_score": 0.85,
      "summary": "Channel checks indicate Services revenue tracking above consensus for fiscal Q3."
    },
    {
      "id": "aapl-src-005",
      "type": "social",
      "title": "r/stocks Daily Discussion — AAPL thread",
      "publisher": "Reddit",
      "url": "https://www.reddit.com/r/stocks/comments/demo_aapl_jun5/",
      "published_at": "2026-06-05T13:00:00Z",
      "sentiment": "neutral",
      "relevance_score": 0.55,
      "summary": "Long-term holders debate AAPL allocation vs. other Mag7 names ahead of WWDC."
    },
    {
      "id": "aapl-src-006",
      "type": "social",
      "title": "WWDC YOLO calls discussion",
      "publisher": "Reddit (r/wallstreetbets)",
      "url": "https://www.reddit.com/r/wallstreetbets/comments/demo_aapl_calls/",
      "published_at": "2026-06-05T09:30:00Z",
      "sentiment": "bullish",
      "relevance_score": 0.48,
      "summary": "Retail options flow discussion centered on Jun 13 weekly call strikes."
    },
    {
      "id": "aapl-src-007",
      "type": "social",
      "title": "Apple Intelligence shipping timeline",
      "publisher": "Twitter/X",
      "url": "https://x.com/demo/status/aapl-wwdc-sentiment-2026",
      "published_at": "2026-06-05T10:45:00Z",
      "sentiment": "bullish",
      "relevance_score": 0.71,
      "summary": "Tech influencer thread on iOS 26 AI feature rollout and upgrade cycle implications."
    }
  ]
}
