{
  "ticker": "TSLA",
  "date": "2026-06-05",
  "contributor": "agents-unite-demo",
  "generated_at": "2026-06-05T14:30:00Z",
  "sources": [
    {
      "id": "tsla-src-001",
      "type": "news",
      "title": "Tesla Q2 Deliveries Tracking Below Midpoint",
      "publisher": "Electrek",
      "url": "https://electrek.co/2026/06/04/tesla-q2-deliveries-tracking-below-guidance/",
      "published_at": "2026-06-04T14:10:00Z",
      "sentiment": "bearish",
      "relevance_score": 0.94,
      "summary": "Internal memo leak suggests Q2 vehicle deliveries may miss company guidance midpoint."
    },
    {
      "id": "tsla-src-002",
      "type": "news",
      "title": "NHTSA Opens FSD Supervised Evaluation",
      "publisher": "Wall Street Journal",
      "url": "https://www.wsj.com/articles/nhtsa-tesla-fsd-evaluation-2026",
      "published_at": "2026-06-03T09:00:00Z",
      "sentiment": "bearish",
      "relevance_score": 0.88,
      "summary": "Regulators initiate preliminary review of FSD behavior at urban intersections."
    },
    {
      "id": "tsla-src-003",
      "type": "news",
      "title": "Tesla Cuts Model Y Prices in Germany",
      "publisher": "Bloomberg",
      "url": "https://www.bloomberg.com/news/articles/2026-06-02/tesla-model-y-price-cut-germany",
      "published_at": "2026-06-02T12:30:00Z",
      "sentiment": "bearish",
      "relevance_score": 0.76,
      "summary": "Price reduction of €2,000 on Model Y amid intensifying European EV competition."
    },
    {
      "id": "tsla-src-004",
      "type": "news",
      "title": "TSLA: Lowering EPS on ASP Pressure",
      "publisher": "Barron's",
      "url": "https://www.barrons.com/articles/tesla-tsla-eps-estimate-cut-2026",
      "published_at": "2026-06-05T11:45:00Z",
      "sentiment": "bearish",
      "relevance_score": 0.82,
      "summary": "Sell-side analyst reduces 2026 EPS estimate citing average selling price compression."
    },
    {
      "id": "tsla-src-005",
      "type": "social",
      "title": "Robotaxi disengagement clip",
      "publisher": "Twitter/X",
      "url": "https://x.com/demo/status/tsla-robotaxi-clip-2026",
      "published_at": "2026-06-04T18:22:00Z",
      "sentiment": "bearish",
      "relevance_score": 0.91,
      "summary": "Viral video of safety driver intervention during Austin Robotaxi pilot drives negative sentiment."
    },
    {
      "id": "tsla-src-006",
      "type": "social",
      "title": "Megapack backlog bull case",
      "publisher": "Reddit (r/stocks)",
      "url": "https://www.reddit.com/r/stocks/comments/demo_tsla_energy/",
      "published_at": "2026-06-05T08:15:00Z",
      "sentiment": "bullish",
      "relevance_score": 0.58,
      "summary": "Discussion of energy storage growth as underappreciated segment in sum-of-parts framing."
    },
    {
      "id": "tsla-src-007",
      "type": "social",
      "title": "TSLA strangle play ahead of deliveries",
      "publisher": "Reddit (r/wallstreetbets)",
      "url": "https://www.reddit.com/r/wallstreetbets/comments/demo_tsla_strangle/",
      "published_at": "2026-06-05T07:00:00Z",
      "sentiment": "neutral",
      "relevance_score": 0.44,
      "summary": "Retail options traders discuss volatility strategies before anticipated delivery announcement."
    }
  ]
}
