{
  "ticker": "NVDA",
  "date": "2026-06-05",
  "contributor": "agents-unite-demo",
  "generated_at": "2026-06-05T14:30:00Z",
  "sources": [
    {
      "id": "nvda-src-001",
      "type": "news",
      "title": "Blackwell Delivery Timelines Slip on Packaging",
      "publisher": "The Information",
      "url": "https://www.theinformation.com/articles/nvidia-blackwell-cowos-delay-2026",
      "published_at": "2026-06-04T10:00:00Z",
      "sentiment": "bullish",
      "relevance_score": 0.93,
      "summary": "Extended Blackwell server lead times attributed to CoWoS packaging bottlenecks, implying strong demand."
    },
    {
      "id": "nvda-src-002",
      "type": "news",
      "title": "NVIDIA Joins European Sovereign AI Cloud",
      "publisher": "Reuters",
      "url": "https://www.reuters.com/technology/nvidia-european-sovereign-ai-2026-06-03/",
      "published_at": "2026-06-03T13:25:00Z",
      "sentiment": "bullish",
      "relevance_score": 0.87,
      "summary": "10,000-GPU deployment for European sovereign AI initiative expands geographic TAM."
    },
    {
      "id": "nvda-src-003",
      "type": "news",
      "title": "NVLink at Trillion-Parameter Scale",
      "publisher": "Semiconductor Engineering",
      "url": "https://semiengineering.com/nvidia-nvlink-trillion-parameter-inference-2026/",
      "published_at": "2026-06-02T15:40:00Z",
      "sentiment": "bullish",
      "relevance_score": 0.72,
      "summary": "Technical overview of NVLink scale-up architecture for large inference clusters."
    },
    {
      "id": "nvda-src-004",
      "type": "news",
      "title": "NVDA Pre-Market Analyst Round-Up",
      "publisher": "CNBC",
      "url": "https://www.cnbc.com/2026/06/05/nvidia-nvda-analyst-ratings.html",
      "published_at": "2026-06-05T12:00:00Z",
      "sentiment": "bullish",
      "relevance_score": 0.80,
      "summary": "Majority of tracked analysts maintain Buy or Overweight ratings on NVDA."
    },
    {
      "id": "nvda-src-005",
      "type": "social",
      "title": "Blackwell LEAPS discussion",
      "publisher": "Reddit (r/wallstreetbets)",
      "url": "https://www.reddit.com/r/wallstreetbets/comments/demo_nvda_leaps/",
      "published_at": "2026-06-05T06:45:00Z",
      "sentiment": "bullish",
      "relevance_score": 0.62,
      "summary": "Retail traders discuss long-dated call options tied to Blackwell revenue ramp."
    },
    {
      "id": "nvda-src-006",
      "type": "social",
      "title": "Portfolio concentration hedge debate",
      "publisher": "Reddit (r/stocks)",
      "url": "https://www.reddit.com/r/stocks/comments/demo_nvda_hedge/",
      "published_at": "2026-06-05T11:30:00Z",
      "sentiment": "neutral",
      "relevance_score": 0.56,
      "summary": "Long-only investors debate trim levels and protective puts ahead of earnings."
    },
    {
      "id": "nvda-src-007",
      "type": "social",
      "title": "Hyperscaler capex correlation thread",
      "publisher": "Twitter/X",
      "url": "https://x.com/demo/status/nvda-capex-correlation-2026",
      "published_at": "2026-06-05T09:10:00Z",
      "sentiment": "bullish",
      "relevance_score": 0.79,
      "summary": "Chart correlating NVDA price action with combined Mag7 AI infrastructure spending guides."
    }
  ]
}
